<?xml version="1.0"?>
<!DOCTYPE abi SYSTEM "abi.dtd">
<abi>

  <messages>

    <message name="BARO_ABS">
      <field name="pressure" type="float" unit="Pa"/>
    </message>

    <message name="BARO_DIFF">
      <field name="pressure" type="float" unit="Pa"/>
    </message>

    <message name="GPS">
      <field name="gps" type="struct GpsState"/>
    </message>

  </messages>

  <async>
    <raise name="MCU_PERIPH"/>
  </async>

</abi>
